34.21.6|Jolly good and hoot hoot hooray! Splendid news indeed! I really can't thank you enough!|Jolly good and hoot hoot hooray! Splendid news indeed! I really can't thank you enough!
14.76.7|Hoo hoo! Why, this is... a killifish!|Hoo hoo! Why, this is... a killifish!
36.45.8|They looked so peculiar that people originally thought they were multiple fossils stacked on top of each other!|They looked so peculiar that people originally thought they were multiple fossils stacked on top of each other!
5.27.3|As a dyed-in-the-feathers optimist AND music fan, I like to think it serenaded the late Cretaceous!|As a dyed-in-the-feathers optimist AND music fan, I like to think it serenaded the late Cretaceous!
12.90.10|Pray tell, might I enlighten you with a few facts?|Pray tell, might I enlighten you with a few facts?
29.31.11|Reptiles are known to be cold- blooded, but there is some debate as to whether dinosaurs were too.|Reptiles are known to be cold- blooded, but there is some debate as to whether dinosaurs were too.
23.62.2|I never thought I'd lay eyes upon such a well-preserved stego skull.|I never thought I'd lay eyes upon such a well-preserved stego skull.
2.67.2|However, requests for fossil appraisals are still most welcome!|However, requests for fossil appraisals are still most welcome!
2.22.2|Thank you for visiting!|Thank you for visiting!
34.21.2|I never thought I'd lay eyes upon the real thing. But there it is, very much a flowery painting!|I never thought I'd lay eyes upon the real thing. But there it is, very much a flowery painting!
4.82.6|Hoo hoo! Why, this is... a bitterling!|Hoo hoo! Why, this is... a bitterling!
12.93.7|As such, the hermit crab has 10 legs and also wears a shell. But it doesn't grow this shell itself.|As such, the hermit crab has ten legs and also wears a shell. But it doesn't grow this shell itself.
40.39.11|The Spinosaurus was a remarkable creature.|The Spinosaurus was a remarkable creature.
18.127.4|Did you know that the repulsive Rajah Brooke's birdwing loves to luxuriate in hot-springs water?|Did you know that the repulsive Rajah Brooke's birdwing loves to luxuriate in hot-springs water?
33.58.7|Its most famous feature, obviously, is its razor-sharp, eight-inch-long, t-t-te-tee-te-tee...FANGS!|Its most famous feature, obviously, is its razor-sharp, eight-inch-long, t-t-te-tee-te-tee...FANGS!
6.94.7|Said organ was likely useful in regulating its—non-dinosaur—body temperature.|Said organ was likely useful in regulating its—non-dinosaur—body temperature.
1.27.9|Yes, now then...|Yes, now then...
14.102.5|suddenly a simple sting seems quite tolerable.|suddenly a simple sting seems quite tolerable.
33.56.8|Thus, I am considering adding fine works of art to this fine institution's repertoire.|Thus, I am considering adding fine works of art to this fine institution's repertoire.
5.25.1|Hoo hoo! Why, this is... a squid!|Hoo hoo! Why, this is... a squid!
14.74.1|Hoo! Woo hoo! This is undoubtedly... a pale chub!|Hoo! Woo hoo! This is undoubtedly... a pale chub!
11.63.5|Hoo hoo! Why, this is... a clown fish!|Hoo hoo! Why, this is... a clown fish!
1.14.6|These flat fish spend much of their lives buried under the sandy ocean floor, waiting for prey to happen by.|These flat fish spend much of their lives buried under the sandy ocean floor, waiting for prey to happen by.
22.68.9|And this is why they are sometimes displayed in certain...ahem... exceptional museums!|And this is why they are sometimes displayed in certain...ahem... exceptional museums!
1.77.5|Now, might I interest you in a few fascinating facts about your dab?|Now, might I interest you in a few fascinating facts about your dab?
13.53.10|I never thought I'd lay eyes upon such a well-preserved parasaur torso.|I never thought I'd lay eyes upon such a well-preserved parasaur torso.
1.95.2|Now, might I interest you in a few fascinating facts about your carp?|Now, might I interest you in a few fascinating facts about your carp?
42.25.7|And now we have opened a new addition, one I have dreamt of since I was but an owlet...|And now we have opened a new addition, one I have dreamt of since I was but an owlet...
21.70.7|Archaeopteryx's feathers led many people to believe it was the progenitor of the birds, eh wot...|Archaeopteryx's feathers led many people to believe it was the progenitor of the birds, eh wot...
1.30.7|The Megaloceros was a relative of the deer that lived during the Ice Age, long after the dinosaurs.|The Megaloceros was a relative of the deer that lived during the Ice Age, long after the dinosaurs.
41.17.7|Eeek!  A pondskater! What a wretched thing...|Eeek!  A pondskater! What a wretched thing...
4.21.5|The black bass is a formidably strong fish and, as such, is a common target for sport anglers.|The black bass is a formidably strong fish and, as such, is a common target for sport anglers.
42.106.3|Why, it seems you have nothing on your person we can accept at this time...|Why, it seems you have nothing on your person we can accept at this time...
2.24.5|I never thought I'd lay eyes upon such a well-preserved T. rex tail.|I never thought I'd lay eyes upon such a well-preserved T. rex tail.
42.106.2|Hoo hoo! Thank you very much! ...My feathers!|Hoo hoo! Thank you very much! ...My feathers!
4.84.1|Eeek! A honeybee!  What a wretched thing...|Eeek! A honeybee!  What a wretched thing...
11.61.6|Eeek!  A Madagascan sunset moth! What a wretched thing...|Eeek!  A Madagascan sunset moth! What a wretched thing...
42.25.6|They have made my spirits soar! Hootie hoo! 'Tis true!|They have made my spirits soar! Hootie hoo! 'Tis true!
2.26.7|With this, we need 1 donation to open the museum!|With this, we need one donation to open the museum!
22.66.7|I never thought I'd lay eyes upon such a well-preserved spino tail.|I never thought I'd lay eyes upon such a well-preserved spino tail.
9.98.2|I never thought I'd lay eyes upon such a well-preserved tricera skull.|I never thought I'd lay eyes upon such a well-preserved tricera skull.
22.68.8|These are valuable resources for learning about ancient eras, such as when the dinosaurs roamed...|These are valuable resources for learning about ancient eras, such as when the dinosaurs roamed...
10.83.1|This large fellow was a bit like our modern rhinocerous, but with two horns on its nose!|This large fellow was a bit like our modern rhinocerous, but with two horns on its nose!
1.77.4|Hoo hoo! Why, this is... a dab!|Hoo hoo! Why, this is... a dab!
9.6.8|And their bite is quite painful too! HOO-rrible things, I say.|And their bite is quite painful too! HOO-rrible things, I say.
1.97.1|Hoo hoo! Why, this is... a horse mackerel!|Hoo hoo! Why, this is... a horse mackerel!
33.56.9|So, if you should find yourself in possession of a piece of art, by all means, please do show it to me.|So, if you should find yourself in possession of a piece of art, by all means, please do show it to me.
23.60.12|Instead, their shells get bigger and bigger as they grow. Hoo! They must get heavy, don't you know!|Instead, their shells get bigger and bigger as they grow. Hoo! They must get heavy, don't you know!
14.102.4|they paralyze their prey, then drag their victims home ALIVE, leaving them for their larva to feed upon.|they paralyze their prey, then drag their victims home ALIVE, leaving them for their larva to feed upon.
1.12.1|Though...I confess, there is one smallish problem regarding said museum|Though...I confess, there is one smallish problem regarding said museum
6.94.6|This REPTILE—not dinosaur—is most famous for the large sail-like organ on its back.|This REPTILE—not dinosaur—is most famous for the large sail-like organ on its back.
33.58.6|Chief actor in my most terrifying nightmares, the Sabertooth Tiger was a mighty predator of long ago.|Chief actor in my most terrifying nightmares, the Sabertooth Tiger was a mighty predator of long ago.
18.127.5|It's true! Hoo! The males gather in groups to sip the moisture while the females hide in jungle trees.|It's true! Hoo! The males gather in groups to sip the moisture while the females hide in jungle trees.
4.116.1|Eeek!  An emperor butterfly! What a wretched thing...|Eeek!  An emperor butterfly! What a wretched thing...
12.93.6|It looks much like a spider—what with its creepy eyes and crawly legs—but is, in fact, a crustacean.|It looks much like a spider—what with its creepy eyes and crawly legs—but is, in fact, a crustacean.
2.67.3|I cannot offer much in the way of hospitality, but do make yourself comfortable.|I cannot offer much in the way of hospitality, but do make yourself comfortable.
34.21.3|Now, if you were to donate this flowery painting...|Now, if you were to donate this flowery painting...
14.76.2|Its spine is sharp as a blade, so care must be taken when handling these beauties...|Its spine is sharp as a blade, so care must be taken when handling these beauties...
5.27.2|Hootie-hoo, Parasaurolophus! I like to think of it as the beast with the golden tones.|Hootie-hoo, Parasaurolophus! I like to think of it as the beast with the golden tones.
43.103.5|Eeek! A diving beetle!  What a wretched thing...|Eeek! A diving beetle!  What a wretched thing...
36.45.9|As a delightful side note, "anomalocaris" means "abnormal shrimp."|As a delightful side note, "anomalocaris" means "abnormal shrimp."
4.59.4|Now, might I interest you in a few fascinating facts about your koi?|Now, might I interest you in a few fascinating facts about your koi?
4.59.6|Koi are a variety of carp bred for their color mutations...starting more than a thousand years ago!|Koi are a variety of carp bred for their color mutations...starting more than a thousand years ago!
5.59.6|Hoo! Woo hoo! This is undoubtedly... a sea butterfly!|Hoo! Woo hoo! This is undoubtedly... a sea butterfly!
6.96.6|The citrus long-horned beetle is a putrid pest and a grave threat to trees. Hoo! It's true!|The citrus long-horned beetle is a putrid pest and a grave threat to trees. Hoo! It's true!
34.21.1|Hoo! I say, hoot! THAT is most surely a flowery painting!|Hoo! I say, hoot! THAT is most surely a flowery painting!
2.67.1|Museum construction is about to begin, and thus I cannot accept new donations at this time.|Museum construction is about to begin, and thus I cannot accept new donations at this time.
18.127.7|They're also quite malicious!|They're also quite malicious!
1.12.3|Empty display cases will not do, I'm told. Display cases with something to display—THAT is another matter!|Empty display cases will not do, I'm told. Display cases with something to display—THAT is another matter!
23.60.10|Snails are not insects, I'll admit. But they're just as revolting to me.|Snails are not insects, I'll admit. But they're just as revolting to me.
46.23.8|Incidentally, despite the "saurus"” name, it wasn't actually a dinosaur. Common error, eh wot.|Incidentally, despite the "saurus"” name, it wasn't actually a dinosaur. Common error, eh wot.
14.74.2|Now, might I interest you in a few fascinating facts about your pale chub?|Now, might I interest you in a few fascinating facts about your pale chub?
11.63.6|Now, might I interest you in a few fascinating facts about your clown fish?|Now, might I interest you in a few fascinating facts about your clown fish?
25.58.2|Hoo! Woo hoo! This is undoubtedly... a coelacanth!|Hoo! Woo hoo! This is undoubtedly... a coelacanth!
4.18.2|I never thought I'd lay eyes upon such a well-preserved myllokunmingia.|I never thought I'd lay eyes upon such a well-preserved myllokunmingia.
44.100.1|i fear I might die just thinking about it.|i fear I might die just thinking about it.
2.25.10|I never thought I'd lay eyes upon such a well-preserved pachy skull.|I never thought I'd lay eyes upon such a well-preserved pachy skull.
10.83.3|I feel there is a valuable lesson to be had there about learning to enjoy a variety of foods...|I feel there is a valuable lesson to be had there about learning to enjoy a variety of foods...
1.14.5|But as it grows, it gets both wider and flatter, and can reach some three feet long.|But as it grows, it gets both wider and flatter, and can reach some three feet long.
11.28.9|The common bluebottle is a type of swallowtail butterfly with a bright blue line running down its wings.|The common bluebottle is a type of swallowtail butterfly with a bright blue line running down its wings.
42.25.4|Stunning! Humbling! At times, overwhelming!|Stunning! Humbling! At times, overwhelming!
1.95.1|Hootie hoo! This must be... a carp!|Hootie hoo! This must be... a carp!
8.113.7|Simply put, the man-faced stink bug has markings on its shell that resemble a human face.|Simply put, the man-faced stink bug has markings on its shell that resemble a human face.
1.30.4|I never thought I'd lay eyes upon such a well-preserved right megalo side.|I never thought I'd lay eyes upon such a well-preserved right megalo side.
21.70.4|I never thought I'd lay eyes upon such a well-preserved archaeopteryx.|I never thought I'd lay eyes upon such a well-preserved archaeopteryx.
1.77.10|These fish spend lots of time lying on their sides in the sand, so the odd eye placement makes some sense...|These fish spend lots of time lying on their sides in the sand, so the odd eye placement makes some sense...
13.53.4|Can you imagine such behavior in an herbivore? It simply beggars the imagination!|Can you imagine such behavior in an herbivore? It simply beggars the imagination!
4.21.6|In some areas, there are even those who professionally catch just black bass!|In some areas, there are even those who professionally catch just black bass!
4.21.7|Yet in other areas where they are NOT native, they are considered an ecological nuisance. Invasive, even.|Yet in other areas where they are NOT native, they are considered an ecological nuisance. Invasive, even.
8.113.6|Never mind this stink bug's smell. What you have here is a bug...with a I FACE...on its BACK!! Wot-wot!|Never mind this stink bug's smell. What you have here is a bug...with a I FACE...on its BACK!! Wot-wot!
9.4.9|The cherry salmon is related to the salmon, and is known for its distinctive pattern of "polka dots."|The cherry salmon is related to the salmon, and is known for its distinctive pattern of "polka dots."
42.25.5|Your gifts of fossils, fish, and... bugs...have not only made our museum a cultural marvel...|Your gifts of fossils, fish, and... bugs...have not only made our museum a cultural marvel...
1.14.4|Did you know that the olive flounder is the same shape as other fish when it hatches?|Did you know that the olive flounder is the same shape as other fish when it hatches?
1.77.7|The dab is a flatfish that bears some resemblance to the olive flounder, though their mouths are different.|The dab is a flatfish that bears some resemblance to the olive flounder, though their mouths are different.
10.83.2|Sadly, their small teeth restricted them to a diet of rather soft plants, and eventually they died out.|Sadly, their small teeth restricted them to a diet of rather soft plants, and eventually they died out.
25.58.3|Now, might I interest you in a few fascinating facts about your coelacanth?|Now, might I interest you in a few fascinating facts about your coelacanth?
1.97.2|Now, might I interest you in a few fascinating facts about your horse mackerel?|Now, might I interest you in a few fascinating facts about your horse mackerel?
11.64.10|Revolting behavior indeed! Ugh and ewww!|Revolting behavior indeed! Ugh and ewww!
1.29.4|With this, we need 11 donations to open the museum!|With this, we need eleven donations to open the museum!
46.23.9|But they were surely a majestic sight,  swimming in those ancient seas... like a long-necked rubber ducky...|But they were surely a majestic sight,  swimming in those ancient seas... like a long-necked rubber ducky...
23.60.11|Snails are mollusks, you see, and are born wearing shells they cannot remove.|Snails are mollusks, you see, and are born wearing shells they cannot remove.
5.25.3|Well, first off, squids are members of the mollusk family, just like the octopus.|Well, first off, squids are members of the mollusk family, just like the octopus.
1.44.8|Best of all, Diplodocus probably grew its entire life, having no "adult size." Would that we were all so gifted!|Best of all, Diplodocus probably grew its entire life, having no "adult size." Would that we were all so gifted!
6.94.5|Ah, yes. Dimetrodon. Not actually a dinosaur, despite what...some people may tell you.|Ah, yes. Dimetrodon. Not actually a dinosaur, despite what...some people may tell you.
1.12.2|That is, I lack the number of exhibits needed to secure permission to open a museum proper.|That is, I lack the number of exhibits needed to secure permission to open a museum proper.
1.30.10|While smaller than many dinosaurs, they were nonetheless a very charismatic example of megafauna.|While smaller than many dinosaurs, they were nonetheless a very charismatic example of megafauna.
18.127.6|And though they dress to impress in red and green, these fluttering fiends are not just stylish...|And though they dress to impress in red and green, these fluttering fiends are not just stylish...
7.17.3|The orchid mantis is a bug whose brilliant colors and petal-shaped limbs give it the look of a flower.|The orchid mantis is a bug whose brilliant colors and petal-shaped limbs give it the look of a flower.
27.44.9|The foul fly is quite the disquieting creature. I tell you, it tastes its food with its feet! Yeep!|The foul fly is quite the disquieting creature. I tell you, it tastes its food with its feet! Yeep!
14.76.1|It's got to keep up with all the other vibrant fish that live in the coral too, I wager. Quite the competition!|It's got to keep up with all the other vibrant fish that live in the coral too, I wager. Quite the competition!
40.39.13|Wonderful! 'Tis fascinating stuff, Il assure you! Now, where to begin..|Wonderful! 'Tis fascinating stuff, Il assure you! Now, where to begin..
12.93.5|The hermit crab is not an insect... Though it most certainly resembles one. Blech!|The hermit crab is not an insect... Though it most certainly resembles one. Blech!
12.90.12|I'd say that T. Rex is the 800-pound gorilla of the dinosaur world, but it likely weighed well over nine tons.|I'd say that T. Rex is the eight hundred-pound gorilla of the dinosaur world, but it likely weighed well over nine tons.
6.96.7|Adults possess powerful jaws and use them to chomp through hard wood and plant fibers with ease.|Adults possess powerful jaws and use them to chomp through hard wood and plant fibers with ease.
41.17.10|Putrid pondskaters! They walk on water, you know...which is most preposterous!|Putrid pondskaters! They walk on water, you know...which is most preposterous!
5.59.7|Now, might I interest you in a few fascinating facts about your sea butterfly?|Now, might I interest you in a few fascinating facts about your sea butterfly?
4.59.7|Well, one glance at their impressive coloring tells you that the centuries of effort were worth it.|Well, one glance at their impressive coloring tells you that the centuries of effort were worth it.
21.71.2|Hoo hoo! Why, this is... a butterfly fish!|Hoo hoo! Why, this is... a butterfly fish!
16.76.9|Hoo! Woo hoo! This is undoubtedly... a crawfish!|Hoo! Woo hoo! This is undoubtedly... a crawfish!
26.31.3|The freshwater goby is an unassuming specimen.|The freshwater goby is an unassuming specimen.
36.46.11|They were very sizable—some 13 feet long, with a shell the size of a small car... If you're into that sort of thing.|They were very sizable—some thirteen feet long, with a shell the size of a small car... If you're into that sort of thing.
43.104.7|There are over 50 different species, each a unique and pleasing color.|There are over fifty different species, each a unique and pleasing color.
44.99.3|Eeek! A scorpion!  What a wretched thing...|Eeek! A scorpion!  What a wretched thing...
46.90.5|But its forewings are also often covered in a dark, velvety hair! You heard right! HAIRY wings!|But its forewings are also often covered in a dark, velvety hair! You heard right! HAIRY wings!
13.52.2|I suppose I should congratulate  you on your good fortune... But catching any bug seems a misfortune to me.|I suppose I should congratulate  you on your good fortune... But catching any bug seems a misfortune to me.
1.15.3|Ahem! I beg your pardon. Bugs...I do detest them.|Ahem! I beg your pardon. Bugs...I do detest them.
1.96.5|They are a varied bunch with some as small as four inches and some as staggeringly ginormous as eight feet!|They are a varied bunch with some as small as four inches and some as staggeringly ginormous as eight feet!
27.43.8|The Triceratops was a remarkable creature.|The Triceratops was a remarkable creature.
9.100.8|For example, the coprolite from certain plant-eating dinosaurs has been found to contain small pebbles.|For example, the coprolite from certain plant-eating dinosaurs has been found to contain small pebbles.
4.119.10|Wonderful! 'Tis fascinating stuff, Il assure you! Now, where to begin...|Wonderful! 'Tis fascinating stuff, Il assure you! Now, where to begin...
9.4.11|Pity the poor researchers that must make sense of the cherry salmon's fickle fashion sense.|Pity the poor researchers that must make sense of the cherry salmon's fickle fashion sense.
1.13.5|My feathers! I have blathered on far too long! But let me leave you with this...|My feathers! I have blathered on far too long! But let me leave you with this...
20.95.3|Eeek!  A giant water bug! What a wretched thing...|Eeek!  A giant water bug! What a wretched thing...
39.64.1|Let me see here. Hmmm...indeed...|Let me see here. Hmmm...indeed...
49.4.4|HOO-WHAT?!|HOO-WHAT?!
20.68.3|The Mammoth was a remarkable creature.|The Mammoth was a remarkable creature.
50.11.7|Hoo! Woo hoo! This is undoubtedly... a nibble fish!|Hoo! Woo hoo! This is undoubtedly... a nibble fish!
1.11.7|So, should you discover a new type of insect or fish, do be so kind as to bring it here.|So, should you discover a new type of insect or fish, do be so kind as to bring it here.
38.30.9|If you acquire any of these items, please do consider donating them.|If you acquire any of these items, please do consider donating them.
2.23.7|Now, might I interest you in a few fascinating facts about your tadpole?|Now, might I interest you in a few fascinating facts about your tadpole?
4.117.5|Young pill bugs shed their exo- skeletons as they grow, and in doing so, sprout another pair of legs.|Young pill bugs shed their exo- skeletons as they grow, and in doing so, sprout another pair of legs.
4.83.3|Bitterlings hide their eggs inside large bivalves—like clams—where the young can stay safe until grown.|Bitterlings hide their eggs inside large bivalves—like clams—where the young can stay safe until grown.
27.43.12|Its three horns and impressive, bony frill probably helped it fight off predators like T. Rex!|Its three horns and impressive, bony frill probably helped it fight off predators like T. Rex!
4.117.4|But the appeal is utterly lost on me. One look at their leggy undersides... Hoo! Ewww! How they wriggle!|But the appeal is utterly lost on me. One look at their leggy undersides... Hoo! Ewww! How they wriggle!
2.23.6|Hoo! Woo hoo! This is undoubtedly... a tadpole!|Hoo! Woo hoo! This is undoubtedly... a tadpole!
41.38.9|I understand that frogs converse with fellow frogs through a number of varied calls, as it were.|I understand that frogs converse with fellow frogs through a number of varied calls, as it were.
1.11.6|Truth be told, I am determined to open a museum and, henceforth, dwell on this island amongst you.|Truth be told, I am determined to open a museum and, henceforth, dwell on this island amongst you.
36.12.6|The entrance to the gallery is but a jaunt up the stairs. Please, do take a gander at your leisure.|The entrance to the gallery is but a jaunt up the stairs. Please, do take a gander at your leisure.
14.103.1|I never thought I'd lay eyes upon such a well-preserved ammonite.|I never thought I'd lay eyes upon such a well-preserved ammonite.
41.101.9|Hoo! The horror! This behemoth butterfly may be called a Queen Alexandra's birdwing...|Hoo! The horror! This behemoth butterfly may be called a Queen Alexandra's birdwing...
12.90.1|What's more, paired with its long neck, this ability greatly increased its reach for eating plants!|What's more, paired with its long neck, this ability greatly increased its reach for eating plants!
49.4.5|Upon closer examination, I have grave news to share with you! This work of art...is a FAKE!|Upon closer examination, I have grave news to share with you! This work of art...is a FAKE!
11.64.7|As if the average locust weren't large enough...we must suffer the long locust too!|As if the average locust weren't large enough...we must suffer the long locust too!
1.13.4|Please, Thea, cross the river and seek out these ancient relics.|Please, Thea, cross the river and seek out these ancient relics.
9.4.10|These polka dots disappear as they mature, but ONLY in the fish of certain geographic areas.|These polka dots disappear as they mature, but ONLY in the fish of certain geographic areas.
9.99.7|They likely ate seaweed, shrimp, octopus, and possibly ammonites, given the era involved.|They likely ate seaweed, shrimp, octopus, and possibly ammonites, given the era involved.
4.119.11|The dunkleosteus flourished long before the dinosaurs and was a sort of armored fish.|The dunkleosteus flourished long before the dinosaurs and was a sort of armored fish.
22.67.2|I never thought I'd lay eyes upon such a well-preserved juramaia.|I never thought I'd lay eyes upon such a well-preserved juramaia.
42.26.1|I beg your pardon! My enthusiasm has me running at the beak once again.|I beg your pardon! My enthusiasm has me running at the beak once again.
